Title,Author,Date,Stars(out_of_10),Review,Sentiment_Score,Polarity
Denzel is a bad mf in this,MLDinTN,2 June 2015,7,well liam neeson must have been busy so the producers got denzel washington to take the lead this character is exactly what neeson has been playing in his recent movies like taken i guess now that denzel is over he wants to become an action star like neeson in this film quite mild mannered robert mccall whom works at a home depot type of store befriends a young hooker well the russian mob beats her up and hes mad first he tries to buy her freedom but when that fails we find out exactly what kind of a guy mccall really is pretty good scene as to how he takes care of the gangsters well the head of the mob is losing money so he sends his ace guy to find out whom killed his guys the guy tracks down mccall and hes not prepared for whom hes up against mccall visits some old friends to find out whom these mob guys are and then its on mccall uses his skills to take care of the bad guys in some pretty cool ways never using a gun final verdict fun over the top action flick if you are tired of shoot outs check this movie out,0.9665,1
Possessed the usual flaws most good guy/bad guy films do,ahthewarmthofthesun,28 September 2014,3,i find it completely unbelievable that teddy didnt take every opportunity to dispatch robert as quickly as possible but as usual the bad guys hem and haw and want to study their deadly foe rather then just try and eliminate him on site i found that unrealistic and as i said typical of these types of movies it of course allows our hero to lay waste to all the baddies and stay standing at the end dumb in my opinion yeah roberts character was not the standard opponent that teddies group was used to coming up against as was spelled out in the movie so they wanted to take robert alive to see if they could find out who he was working for but still just thought it made little sense that the baddies would not attempt eliminate such a dangerous threat asap,-0.9439,0
"A decent flick, but predictable",erikmsandreid,22 December 2020,7,if youve seen any great action movies the last years youll see nothing new with the equalizer the movie was well made acted paced directed and entertaining only complain i can really make of the movie is that its too formulaic with other movies like taken sherlock holmes or even john wick the plot is anything but unpredictable if this wasnt the case you would easily look at a or maybe even movie in the equalizer go give it a watch if you havent already,0.7992,1
Very Good,lukepassport,12 July 2020,7,was recommended by a work colleague fully enjoyed would recommend to others denzel washington was really good,0.8847,1
A Thrilling Action Film with Denzel Washington's Stellar Performance,cinephilescientist,23 May 2023,8,the equalizer starring denzel washington is an impressive action film that delivers a satisfying experience the movie captivates the audience with its engaging and fastpaced narrative from the beginning the action scenes escalate the tension providing viewers with a visually stunning spectacle that keeps them on the edge of their seats denzel washingtons performance is one of the standout elements that make the film truly worth watching portraying a strong and determined advocate of justice he showcases his acting prowess at its peak washington skillfully embodies the character displaying both physical prowess and emotional depth the films visual effects and cinematography also contribute to its success the action sequences are intelligently crafted with wellchosen camera angles and swift editing resulting in a breathtaking experience these scenes take the audience on a thrilling journey maintaining a high level of action throughout and enhancing the overall quality of the film however it can be said that the story is predictable at certain points some plot twists can be anticipated which may slightly reduce the excitement for some viewers nevertheless the satisfying performances and impressive action sequences help to balance out this predictability factor the equalizer can be regarded as a highquality action film that offers an engaging experience thanks to denzel washingtons magnificent acting and the visual spectacle it presents despite some predictability in the plot the film succeeds in captivating the audience with its satisfying performances and a strong pace of action it is definitely a recommended watch for action enthusiasts,0.9971,1
Cliched But Entertaining,annie-17136,6 May 2020,7,just viewed this movie tonight denzel fans should enjoy it similar to his role in man of fire it is essentially a good action movie about a bad good guy going after the bad bad guys russian mobsters and the good bad guys corrupt cops after an encounter with a young prostitute in a cafe i loved the original tv series edward woodward was one of my all time favourite british actors from the immensely enjoyable spy series callan and the movies wicker man and breaker morant i was hesitant to watch this film as i thought it was going to be an over the top american take on a classic british show while it may be over the top the film doesnt resemble the tv show except for his name this film is quite gruesome in its action scenes and the over use of squelchy sound effects when denzel dishes out his justice is annoying there are some good performances from other cast members marton csokas is excellent as the softly spoken cold to the bone marrow russian sent to sort things out the fight out near the end of the film is dark as in not enough light to see whats going on but you knew when someone got slaughtered as the loud squelching sound effects kicked in the scene with some constructive use of razor wire had me laughing denzel manages to quickly rig up a pully type arrangement with razor wire while being pursued by five baddies anyone who has ever tried to work with wire knows it is the most uncooperative stuff ever invented and certainly wouldnt magically uncoil without a big fight denzel is one step ahead of everyone in this film and we get the idea that denzel may have been a bad guy in his earlier life but the ending was too quick which spoilt all the previous tension building retribution and that is all i have to say about that,-0.0,0
"Breathtaking, phenomenal, astounding, remarkable!",breathedirt,28 June 2018,10,theres always something to improve but i had to give this movie it movie was simply remarkable and even though the story was predictable to an extent it seemed to me as if every scene of the movie was carefully planned directed reviewed and redirected to make it look meaningful and extraordinary at the very beginning there are several scenes shot at a small cafeteria where denzel goes to read books and which also a young escort girl frequents when they are having a conversation the escort girl surprises denzel with her knowledge of people the small clues she learned to observe about people when working as an escort im teri bob you dont look like a bob you look like a robert robert reads books like this bob watches tv when she is severely beaten up by her pimp denzel decides to come back from his retirement and bring justice one last time he then kills her pimp and everyone else in the room who underestimated him because of his age and calm personality when nicolai marton csokas comes to the city to clean up the mess and get rid of the killer denzel he gathers all the information available until he narrows down the suspects to denzel and pays him a visit impersonating a police officer investigating a murder when leaving ill be in touch dont you want to leave me your card officer in case i remember anything thats what you policemen usually do right must have given them all out how did you find me last but not least the ending fighting scene was simply phenomenal it was like home alone for adults denzel as kevin and marton with his mercenaries as the burglars who in this rrated version didnt end up in jail by the way i really dont understand the negative reviews here enjoy,-0.9732,0
Too long and full of action tropes,omega145,20 September 2021,6,pros denzel without him this movie is very bad chloe not in the movie enough strong scenes between the good hand to hand combat unique weapon use cons villain caricatures stereotyped russian mob dirty boston cops action movie tropes ex special forces works a normal job and gets sucked back inexplosions with main character walking away does this really need to be over hours long little character development for being such a long movie,-0.5849,0
"Virtue, valor, strength and Denzel to bring it all together",stevojaxon,30 December 2019,8,it is going to be good even before i see it denzel picks roles that work for him the budget is there to support it and the film maker is good at what he does its a formula and it works to produce movies that i enjoy a lot in recent years there have been similar hero antihero movies coming out with big name stars playing them i remember a lot of them being similarly good after i watched the equalizer i thought to myself that i knew it was going to be good,0.9678,1
Great .... except the end.,lucas739,12 January 2015,7,i sat down to watch this film not expecting much but i have to admit i was pleasantly surprised i enjoyed it so much i was compelled to write a review so that says something denzel washington puts in a solid performance as the lead character ably supported by a rather hot chloe grace moretz amongst others plus a host of your usual eastern european tattoo covered mobsters the film builds nicely from a rather slow start a start which contrasts well with the action to come giving you no clue as to what will unfold my only caveat is with the end sceneboss fight thankfully it wasnt a shirtless gladiatorial fight to the death however the scene is set inside a diy superstore where our hero uses a variety of store products to dispatch those pesky russians i can see a parody where as he hangs one baddie with barbed wire using cement bags as a counterweight i can see him pausing to say barbed wire not just for fencing and only a foot he proceeds to use a cordless drill some kind of long handled shears gas bottles etc etc just looked a bit naff and took the edge off what was up until that point a very solid film definitely worth a watch,0.9835,1
Equal to nothing,deastman_uk,14 October 2014,4,this had the magic combination of unpleasant violence without relevance there was absolutely nothing original zero thats unusual it wasnt a star vehicle for anybody denzel could not decide whether he was charles bronson or steven segal he settled for forest gump perhaps hit girl could have done better too the film could have been almost minutes shorter but insisted on nonsense exposition of the revenge type but every aspect of this type of film has been bettered elsewhere id be surprised if the russian community dont complain every russian with a line or grunt was a dumb psycho please just ignore this pile of shite,-0.921,0
Good,texastom-83964,19 August 2018,7,very good film worth watching,0.6549,1
Im blown away its amazing action film,moviesfilmsreviewsinc,2 September 2023,9,denzel washingtonsthe equalizer is a highimpact reminder of his diverse career combining action thrillers and dramas the film is based on the tv series man on fire and stars edward woodward as a former covert operative despite lacking gravitas the movie is sturdy in pure entertainment with washington taking his stealth vigilante role seriously he pulls out his charm and deadly force unlike many of his oscarnominated performances in flight or malcolm x at denzel remains dependable as a man who gets the job done and draws a crowd at theaters the equalizer stars robert mccall as a lowprofile clerk at a boston home depot washington a former gladys knight backup singerdancer lives a serene life with his coworkers who respect his quiet demeanor mccall jokes about his past mentioning he used to be a pip a character he plays with respect and trust the film explores themes of past relationships friendships and the impact of past experiences on the character mccall a skilled and skilled pip can predict explosive situations with precision and swiftly eliminate potential threats he uses a watch timer to determine the time it takes to eliminate a threat despite not using these skills for a while he spends his nights reading classics in an allnight diner he is soon called upon to use his fighting skills after meeting a wounded teen call girl who hangs out at the restaurant between clients his skills are evident in his ability to predict and eliminate potential threats the equalizer is a violent action film directed by fuqua featuring a crude ballet of violence and water aiming to wash away evil the films showdown in a megastore workplace is entertaining as it showcases washingtons ability to transform everyday hardware supplies into lethal weaponry the film serves as an origin story for a new franchise with an ending that suggests a new franchise is afoot the film also acknowledges that those who qualify for a senior discount can also be crusaders making it a welcome addition to the action game the films focus on mayhem in a place of commerce is a fan favorite since dawn of the deads climactic zombiesvshumans battle denzel washington returns to the role of former blackops commando robert mccall in the film the equalizer a remake of the tv series the film follows mccall who volunteers to assist a young prostitute named lena chloë grace moretz who has been assaulted by her pimp mccall has a meticulous daily routine including a smoothie in the morning working at a diy superstore and advising colleagues at a diy superstore he also spends time with lena sharing his wisdom and reading classic works of literature the film is a small drama with a vague air of menace and its quite compelling the equalizer is a small drama with a vague air of menace making it a compelling addition to the genre mccall a yearold actor takes out lenas assailants in just seconds at a private bar leading to a chaotic situation the pimps are part of a massive russian crime syndicate led by pushkin who sends his enforcer teddy to deal with the situation dozens of people are killed shot dead and their testicles thrown in their mouths the film has two issues the desensitization to violence and the audiences disbelief as the toughest killers are laced by a man who can remember the moon landings despite these issues denzels performance as teddy is impressive making even the most preposterous action scenes thrilling however his strength lies in his convincing toughness preventing the endofthesecondact moment where everything seems lost as mccall returns to overturn the oligopoly the film forgets the issues of ageing and loss which could be remembered when mccall returns for a sequel,-0.9486,0
"Nothing new here, but some great action",funtasticfour,21 July 2018,7,denzel probably invented walking away from an explosion too be honest hes got a dad bod but hes still kick ass is it confidence not sure but its always a pleasure watching him kick butt what else to say soundtrack isnt too bad and some shots are very stylish and cool looking watched this for the third time in anticipation of the sequelwhich i wont see in the theatre even though i did the first i do remember enjoying the tv show this was based on yet another reason to get some retro tv channel,0.957,1
The Bar Has Been Raised,arclinecreative,3 December 2018,9,great writing great lead denzel and super intensity,0.9201,1
Entirely too predictable..,manojative,2 November 2014,6,the only thing that was not predictable was somehow you sensed some twist is coming but it never does a regular superhero movie without being called it that the protagonist our beloved mr washington never sets a foot wrong never ever gets beaten and is always two steps ahead of the bad guys the action sequences are well done and i quite enjoyed them the humane story arcs of helping someone at your mundane jobs playing batman at night and telling that he had a dark and painful past was too forced he takes a break from all the action travels to some important persons house for a few days just to explain that there is a past minutes just for that out of nowhere there is absolutely no reason for anyone to spoil the movie it spoils itself,0.8262,1
"Nice killing scenes, but poor story",DaNunes,18 February 2015,8,a classic denzel washington movie his looks and faces blazing guns and some story and you enjoy the hell out of it its an entertaining movie just to watch relax and see some shooting the story is full of clichés such as military background going under the radar prostitutes to save and all that but in the end you end up liking it however there were some issues that i found annoying the thing with his watch that he uses only in some parts of the movie to time his actions is never explained the old russian mob cliché old story other actors really no one could find that girl and just like that get all the images for all cameras from six blocks yeah,0.5804,1
True Justice,victuki,23 October 2014,7,based on a tv show from the s but with some changes mccall was a british sas exoperative not an american comes this remake directed by antoine fuqua olympus has fallen denzel washington is robert mccall a former cia operative that is morally compelled to go back into action to help a lady in distress though it looks like the ateam it is surprisingly deep in terms of character motivation and those characters are way better performed than the standard blockbuster movies fuqua is reunited with washington after training day the film that got him an oscar award as best leading actor fuqua has made some major blockbusters but all of them very well crafted and full of deeplayered characters that reach you king arthur or shooter both blockbusters that were also critically acclaimed he usually gets to work with solid cast and this time is no different chloë grace moretz dark shadows or marton csokas lord of the rings or the bourne supremacy support washington and they both deliver csokas is great as a crazy russian operative bottom line a great action movie the kind you watch all over again every time is on tv lets not kid ourselves if we had to choose a film to take with us to an isolated island we would not choose a david lynch or a hitchcock film but something like this or the lethal weapon saga nuff said,0.994,1
Great action flick,johnandreas86,25 August 2018,8,wellacted with interesting characters and excellent action scenes,0.7506,1
A lot of action and clichés,d_anik,8 June 2021,6,includes lots of action and clichés but by no means boring the tension lasts until the end marton csokas is brillant in his role but somehow denzel washington doesnt fit the role of a tough guy,-0.9025,0
Such a waste of good material and acting,dr-ross-taylor,17 November 2016,2,this movie was such a disappointment i felt compelled to write my first review denzel washington usually does a good job of selecting movies to star in that are good for what they are some are deeper than others but that is ok because whether the movie is mindless action deeply inspirational comedy of some other genre it is still entertaining if it is done well this is the first movie i have seen of washingtons where i felt the movie was well below average the acting was fine but the storyline was stupid it alternated between trying to be deep and thought provoking only to then have the characters do things that would be incredibly stupid in real life the writers and directors were just being lazy and having characters do things to make a point they wanted to make or to advance the plot with no regard for whether or not it made sense for that character to take that action i loved the equalizer series part of the charm was that edward woodward was a secret agent who was past his prime he was still very competent but he had to rely more on planning and getting help from others i knew that would be difficult to do in a movie format instead of a series but i had hoped that with denzel in the movie it would at least be good instead the movie starts interesting enough then gets stupid spoiling the more thoughtful storyline has a brief intense action scene and then for the rest of the movie i had lost respect for the credibility of the plot and was alternatively bored at the attempts for depth the laziness of contrived plot points and the over the top action this movie was such a waste of talented actors the actors did a good job with the well written plot line and if the movie would have stuck to trying to be a story driven drama it would have been very good the action scenes were good but getting to them seemed contrived it was like they wrote the action scenes then had to figure out how to work them into the movie if the movie wanted to just be an action movie with very little meaningful plot the scenes would have been very good but there needed to be more action i cant recommend this movie to anyone if you are in the mood for action there is not enough if you want a compelling storyline they do not tell it well and insert dumb scenes into the movie to either preach at the audience or to give an excuse for the action scenes it seemed to me like the people making the movie had a good story but then were worried that the general viewing public would be to stupid to get the point if they did not include lots of talking about the evils of no spoilers and then throw in some action scenes for the masses i still plan on watching any movie with denzel washington in it this rubbish was not his fault unless he had creative input but i continue to be disappointed at the large number of movies being produced that seem to cobbled together to reach an audience but lack focus on being entertaining,0.9922,1
Very underrated film,danielhart-87957,2 April 2017,7,despite this been a pretty solid film it is generally criticized in the film community it is an action film but a wellstructured film denzels character does fool with you which such a simplistic approach to life that does not prepare you for the rest of the journey to those who enjoy taken you must enjoy this we discuss why we like this film on our movie podcast,0.7741,1
And Justice For All,OMTR,9 May 2023,9,denzel washington is robert mccall a man who leads a quiet life in boston works in a hardware store helps his colleagues at work and in their private lives whenever they ask for help and spends part of his nights reading in a small and restful allnight diner of his neighborhood there he meets teri an underage prostitute exploited by an eastern european mafia one night teri disrupts her habits and robert investigates her disappearance only to find her beaten to death in intensive care at a nearby hospital this is when we start to learn a bit more about roberts past and who he can be when justice doesnt prevail denzel washington and chloë grace moretz turn in great performances in their respective roles as do the actors who play loathsome villains,0.886,1
Not bad,djfrost-46786,22 November 2018,6,this isnt a bad movie its not a but not a like i rated it somewhere in the middle why ahhhhhhhh its a modern version of the book of eli i guess if you have seen john wick you have seen this movie good movie just not original,0.6772,1
The first film of The Equalizer based on the TV show.,jackthepgl,10 August 2023,8,based on the tv series in the the equalizer came to my mind now i have not watched the show in general but since i heard of this movie everyone knows denzel washington is a fantastic actor and hell do anything to keep up the best quite frankly the sequel came out in and i havent seen it yet and ill get around to doing it all right lets just get on with it a u s marine turned dia intelligence officer named robert mccall played by denzel washington who works at the home mart hardware store while spending some late nights reading in a diner and he comes across teri played by chloë grace moretz who works as a teenage prostitute for the russian mafia one night she is hospitalized after being beaten by her pimp named slavi he meets her friend mandy and he visits slavi to buy her freedom you know this is just like john wick to me not just to say that its been released the same year but to think that the action scenes look very similar the fight scenes are very well choreographed and denzel does an impressive job with the fight scenes some people say that this is one of the best action films in depending what i saw id say i liked what i see this is a really good film,0.9912,1
