Title,Author,Date,Stars(out_of_10),Review,Sentiment_Score,Polarity
One of Denzel's best works,monstermayhem32,27 September 2014,8,i would say that denzel gives one of his best works on the film as robert mccall an ex cia agent who wants to put behind his cia does and live a quiet life while helping those in need one night robert merts a girl named elena played by chloe grace moretz who reminds me of jodie foster when she played a hooker in taxi driver one night robert finds out that elena was beaten up rather badly by one of her clients and takes it upon himself to seek justice for her his own way by going after those that intimate and threaten others while offering life lessons to those in need who seek his wisdom i would have to say what makes robert a complex hero who is forced by dire circumstances to become something that he is not but while still maintaining his sense of right and wrong,0.0772,1
"Moral of the story is: Don't mess with Obama, I mean Denzel",athena-j-dennis,15 December 2014,9,obamai mean denzel swings some seriously massive and intimidating american penis against russian mafia in this film in all seriousness though this film is totally awesome it features great actor denzel washington who does have an uncanny resemblance to the president he is the man not to be messed with in this film the narrative pits an unethical evil and corrupt russian underground with a righteous courageous and overall good american hero denzel this was a narrative of good versus evil that was very popular in other films during the cold war era therefore its hardly surprising given the recent political events in russia and the ukraine that this film is also very much following along that well trodden path although i am making it sound as though its clichéd it is actually a good film and denzel is always great to watch on screen of all of the shoddy action films out there i would rate this one highly which is surprising as im a woman and i normally absolutely hate action movies,0.907,1
Fuqua fails again,FabledGentleman,12 January 2015,3,this is basically a reboot of man on fire which was also starring denzel washington the equalizer is a dumb unoriginal and boring movie with all the classic elements of a bmovie the stereotype badass russian gangster boss that earns more money than bill gates and warren buffet combined it seems needs to be put down by the ex cia american anti hero which only wants justice his own way puke olympus has fallen was a disaster of a movie where north koreans attack the white house and all the clichés known to man was presented after one another in this movie its the russians living in the us with their drug money and their bad attitude taking advantage of the great american country and its hospitality those damn mean russians yeah i see where you are going with this fuqua so whos the badguys in your next movie iranians or did you already make a movie with them if only the acting was inspiring or the story had something interesting to tell if only they showed something new if only the dialogue was anything close to creative if only the script writers knew what they were doing if only fuqua could learn how to direct speaking of that he seem to have taken the same path as shyamalan except fuqua never made a really awesome movie training day was ok but noting more well this is a bad action movie it starts off really good for like minutes i enjoyed it quite a lot it promised something and then it just turns out to be the lovechild of taken and man on fire bad,0.2417,1
It glued me to my sofa; can't walk away even the nature's called.,hitzujaa,10 May 2017,10,it is not a runofthemill rotm action movie with ton of explosions and gun fires it is one of a kind generally speaking rotm action movies always hurry to tell watchers who is a guy and his background and also his motivationreason of action that is almost tell us everything then nothing left is be explained and he just shoots at everything that moves on the other end of the spectrum this movie tells us nothing oh he is just an employee in home mart at boston well it seems that he enjoy his job but not his life whats next he might have something in his mind or a ghost form the past perhaps the director antoine fuqua and writer richard wenk just know how not to be spoonfeeders if denzel washington is white he is very fit to agent role i have got nothing else to say but it is mustwatch film,0.598,1
Denzel's Acting Is Amazing,arobinson0182,19 March 2015,10,the right of seriousness is in this movie and the funny parts in this movie is enjoyable his acting is solid he plays good guys well and plays bad guys well denzel has great intelligence when he acts i got more and more interested as the movie went on i like how denzels character is smart respectful and likable that also fights when he needs too the way he helped people was nice and the way have gave good advice to people he knew and met felt kind denzel can play these roles good lets see anything i dont like about it um well the movie did not show what happened to the store where his character worked but its not a big actually no problem at all i cant think of any reasons why i dont like the movie i was too busy enjoying the movie,0.9818,1
It is the depth of the Characters as brilliantly woven together by A. Fuqua that Earns a 10 from me.,Relkinlaw,10 August 2016,10,this movie is about the war of good and evil the transformation of the hero denzel from killer to protector and his ardent wish to be in the service of gooda redemption from his black ops background i believe it is the subterranean nature of this conflict that makes him an antihero his past was something he describes only to teddy ive done a lot of bad things in his life things for which i am not proud the use of violence by dw in his past is unquestionably evil and a disease from which he suffers he is unable to sleep and dream and from which he must find redemption clear ref to bush era of targeted assassinations imprisonment and rendition of huge numbers of violent men taken to black sitesfor money and never based on any evidence thus he planned his death to avoid destroying his soul because he knew the things he was told to do were fundamentally evil there was never any real basis for their death or imprisonment nor was the bush admin ever able to do anything but lie about the use of violence thus with violence coopted by the government for whom he worked he is a man who has lost any faith that his work had or could have a moral basis we meet dw in this shadowy world of dreams he reads the old man and the sea by hemingway and don quixote by cervantes and the reason he is doing this is spiritual he keeps a connection with his wife recently having passed through this dreamworld of fiction she had begun moreover the old man has no name yet he fights forces of nature to be himself don quixote fights for freedom in a time when his abilities are out of sync with the nature of the times so too dw learns that he is both men thus when he returns he plans and executes his own death and is symbolically reborn by destroying true evil,-0.9929,0
an equalized john wick?,kokorikos,4 March 2017,9,if u ask me which is better john wick or the equalizer i ll say with no hesitation the equalizerthe hero is a badass too yes kicking asses putting traps predicting everything but its denjel a good actor and the movie has a plot a believable plot although some clichés are here tooin fact the entire story is upon denjel s shouldersand he made it his fight style is also natural and well performed and not gun fights and shot heads like wick sthe villains are also believable in their partwell i enjoyed it,0.933,1
Equal to what -predictable sugar or the substitute,coimedia,27 September 2014,4,the equalizer is a formula movie i guess the actor was in between doing something interesting it was cute to see him save russian hookers if that is your idea of living vicariously though a lot of psychotherapy as to why you will never make it he seems to be lost in a giant hardware store like the ones we all go to of course what a better place than there to have action scenes like chasing people it was sort of superman without the cape and tights basically mr washington is predictable and although remotely interesting you know exactly what is going to happen he wins every fight just like superman and no one is even close to beating him the writers do show a few levels of creativity with how to kill the bad guys they seem to neglect the obvious of using identity theft which seems to be the biggest scare we all have when using our credit card in a store like that robert stack,0.7845,1
Denzel at his best.,akujikhalas,21 August 2018,9,cool movie also reminds us about the weight of comeuppance,0.3182,1
Thrilling,The-Sarkologist,11 June 2018,8,i must have missed this film when it came out and in a way its a bit of a shame because it is actually a pretty cool film come to think of it it did remind me a lot of the television series chuck but only in the sense that the protagonist happened to be this black ops specialist who was working in a bunnings style hardware store well not quite black ops because he has retired but in many ways he still seems to be set in his ways anyway he has this habit of going to an all night diner around am to have a cup of tea and he even brings his own teabag they just supply the water so he strikes up this conversation with this girl over time and it soon turns out that she has landed up in a bit of trouble she happens to be a prostitute but not one that is doing it willingly and her pimps are basically treating her as a disobedient possession as such he decides to go and teach them a lesson well he is polite at first but these type of people tend to be so cocksure that he eventually shows them who they are actually messing with well one doesnt simply walk into a restaurant owned by the russian mob and pretty much take everybody out without drawing some attention to yourself and this is basically what happens a highly trained special forces operative who happens to be the guy that cleans up messes for the mob boss comes over to the united states to find out what is going on well i guess you can probably see where this is going it isnt really one of those fast paced movies at least at first but that has more to do with the cat and mouse nature of the protagonists both are quite highly trained soldiers though one of them doesnt like to let it on while the other seems to want to show off his skill any change he gets it seems to relate to the various types of power relations soft power and hard power one rules by the first while the other simply rules through what he doesnt do we obviously suspect who comes out on top in this particular movie but then again the ending is generally pretty much set out right from the beginning i guess this film touches on a few things but once again it seems that the russians are being painted as the enemy even if it isnt a hangover from the cold war it does seem to create this stereotypical image of the brutal and hard russian who lives by his own rules once again they seem to be taking upon the mantle of the bad guys and even if they arent kgb they are russian mafia but the difference is that they tend to be somewhat less refined however when compared to other mafia group they do come across as the more brutal and nasty of them yet it was still a pretty cool movie and there were a couple of little subplots thrown in as well which all tie up nicely in the end however one interesting thing is that they dont always show our protagonist acting sometimes such as when he went after the armed robber there is only an implication of what actually happened we know he found him but we dont know what he actually did to him we just know that he eventually got what he wanted this was well done in a way its a pretty cool movie and certainly worth watching though one of the main reasons i wanted to watch it was because i saw a preview for the sequel where he happens to be posing as an uber driver,0.8266,1
Equalizer Is Better Then My Expectations,raptorsanford,9 May 2024,8,the equalizer is nothing like i expected which isnt a bad thing by the way i sat down watching it and the first scene with robert using his superhero like ability where he sees in the room i was just in complete shock because it was something i wasnt expecting out of that movie also robert definitely has ocd right because theres moments that feels like he does they pay a lot of focus to it specially at the diner its a really unique and interesting plot where hes just trying to get people peace and help them achieve what they want to be even in the beginning of the movie hes trying to help ralphie get a job as security its a really fun movie i gotta say this is a movie that ill watch again whenever possible,0.931,1
Modern Adaption of the 'Man-With-No-Name' Theme,MovieGuyFunTime,13 April 2021,8,this is a good modern take on the strangercomestotown and kills all the bullies theme probably most paralleling the story line in clint eastwoods pale rider perhaps the story is familiar but it is always a satisfying one if done well still with knowing basically how its all gonna go down the mystery is in the various characters who are all wellwritten and mostly multidimensional there are some nice touches that lend to the mystery of the characters the acting and directing is very good and the action scenes are superb there were also some very powerful though subtle moments that really gave the film weight such as denzels passing reference to don quixote the book he is currently reading which helps set up his motivation still somehow it feels like this kind of movie is not a denzel washington vehicle he does a very good job but it was not the kind of role i immediately accepted him playing the equalizer was good but suffered from several detracting plot holes that were entirely unnecessary and not required to move the story they should have been done differently and some not at all these were big distractions for me that maybe others overlooked but they stood out and quickly diminished the overall film in my estimation these are why does the cop locked in the car depend on denzel to roll down his window so he can breath why doesnt he just open the door last i checked you can easily get out of a locked car simply by opening the door andor pressing the unlock button from inside they went for some kind of unique sadistic styleplay here that fell flat on the grounds of logic how does denzel use the cops credentials to access the cops safe deposit box at the bank the cop is white all banks require photo id and matching signature of the box holder to access a safe deposit box even if they know you personally it is the law and they have to log it nobody can access your safe deposit box unless they are preapproved by the owner of the box i guess they figured nobody watching this film would actually have a safe deposit box fail denzel puts various canisters of combustible items in a microwave while the power is out when the bad guy enters the room with the microwave denzel reconnects the power the microwave starts cooking and sec later boom the canisters explode killing the bad guy who on gods green earth makes a microwave oven that starts cooking as soon as power is connected to it essentially as soon as it is plugged in stupid the drill did the bad guy back up into it off screen it doesnt show denzel pushing it forward into the guys skull so how did it penetrate who just stands there and lets someone drive a drill bit into their skull anyway and the nail gun no nail gun works like that in a society where lawn darts have been taken off the market for safety reasons we have nail guns that are equivalent to heavilyregulated hand guns do i need to pass a criminal background check to purchase that nail gun why buy a regular gun when you can buy a nail gun and kill people then build their coffins with the same tool after he kills the first baddie in the home mart why didnt he take the bad guys gun it is just there hanging on his body for the taking but denzel leaves it and prefers to kill them in other more creative ways the sad thing is that none of these logic problems were necessary to tell the story they were all just gee whizz moments that were intended to show how clever and smart our hero is but instead it only shows how gullible and stupid the writers think the audience is if theyd just left these scenes out or done something more believable but maybe not as mcgivery the film would have not slipped into ateam goofiness this handful of mistakes unfortunately and unnecessarily detract from an otherwise engaging and immersive film one nice surprise on the dvd special features was the spoof commercial for home mart staring denzel demonstrating the use of various helpful tools this was a hoot and made up a bit for the braindead moments mentioned above still a good movie but given all the other qualities of the film that were done so well it is a puzzler how these few really stupid moments made it to the final cut,-0.5749,0
"By the numbers, generic paycheck film for all involved",TheMarwood,15 December 2014,4,denzel washington brings nothing but his availability to show up and sleepwalk through filming playing a character that requires practically nothing from the man but look serious this is a step up in craft from director antoine fuquas previous film the sloppy olympus has fallen but despite being competently made the equalizer feels like lazy paycheck work theres nothing that you havent seen a million times before here and the generic story unfolds without so much as a single surprise this is by the numbers stuff its not a chore to sit through which is about the highest compliment i can give it but the second any character is introduced you know exactly how they will be used in the plot and their fate they are either simply good or bad no development beyond that add to that a horribly miscast chloë grace moretz despite an ending you can see minutes into its bloated minute running time a tacked on set up for a future franchise of more vigilantism feels forced and undeserving cant wait for his next adventure against a group of ethnic clichés who wronged a hapless girl while hes trying to make good at a dead end job,-0.9489,0
Well written and produced,allanlunn,9 September 2019,10,the pace and setting of this movie is excellent the acting is fantastic and is entertaining from start to finish the choice of background music works perfectly if you havent watched this film yet then you need too,0.9371,1
Law Abiding Citizen Meets Taken! Denzel Rocks! Phenomenal,louisc1987-184-556240,13 December 2014,9,after watching the trailer for the equilizer i was pretty pumped to watch the movie in the cinema but didnt get round to it i watched it yesterday and must say even though i thought it would be good judging from the trailer reviews and concept of the movie i was blown away by how much better it actually was denzel was immense in that vigilante role and played it to the bone in every way possibly it was also great to see denzel doing all of his own stunts and fight scenes instead of seeing your action man in one scene kicking butt to then changing into a completely different person the next the revenge storyline we have all seen before but the way denzel portrays his role makes it even better in this film the villain played martin cskoas was really top draw too all the actors played there role perfect and the action scenes were superb overall it was a great movie without hardly any movie mistakes it reminded me of law abiding citizen meets taken,0.9871,1
Best Bad Ass Movie ever possibly IMHO,mrozman-1,18 February 2017,10,great story and the character build up was done so well with this movie that you cant help but get sucked in and love denzel the story is unique but it has to do with the timing of the release its possibly that this movie would be just another one of those types of movies which i cant state as i dont want to spoil anything then end is very well done which is hard to do as a lot of movies are ruined by the very fact that they dont hit the bulls eye sometimes they come close and sometimes they completely miss the mark with this movie i think they hit the bulls eye so you have a good movie and a good ending no one will not enjoy this movie and if youre a denzel fan it may become your favorite now i want to watch man on fire again and i will definitely be watching this movie again this goes into the family movie library,0.9021,1
Hollywood version of South Indian Masala Movies..!,HowsItOpinions,26 August 2019,8,yeah its true the story definitely from south indian masala movies we have plenty of films which has the similar storyline especially pokkiri which released in telugu tamil languages and later in hindi with title wanted i feel like watching a desi movie which shot in hollywood style i recommend this film for who loves to watch south indian masala movies,0.9371,1
One man show,ahegde3149,4 April 2015,4,the equalizer is just another generic and stylized hollywood action thriller powered by its lead man denzel washington the story is nothing new and blandly predictable only a person who has never watched a hollywood action film in his entire life would like this screenplay denzel washinton plays a mysterious man in his named robert who seems to possess highly professional skill sets of cia agents type he is seen settling with a peaceful normal life till he crosses path with a young girl alina chloe gracemoretz alina is a prostitute and is need of serious help when she is badly beaten by some arrogant client and faces threats from her mobster russian bosses steps in our superhero the equalizer cleaning up the bad guys in matter of seconds the mob kingpin in russia pushkin sends his best skilled man teddy marton csokas to get rid of our hero and the battle begins honestly i felt the pacing was slow and boring whenever there was no action involved talking of the action our hero seems to have solution to any situation just like liam neeson in taken and at the end of the we all know what is the outcome of the story despite many of its shortcomings i must admit both denzel washingtons acting and character were both kickass and very much likable robert a man who is willing to help anyone in trouble and lives a simple selfless life who wouldnt like such a person the action scenes were cool ignoring the clichéd slowmotion shots the way robert examines the situation before he strikes was awesome the bad guy teddy was nothing more than typical russian bad guy in hollywood films chloes role felt more like a guest appearance rather than supporting the background score was bit too melodramatic overall i felt the film was quite boring i would suggest this film only for action lovers who want the protagonist to come out unscathed magically from any situation and beat the hell out dozens of bad guys single handed and also for fans of denzel washington others should not bother rating,0.6742,1
great movie!,coltonboswell195,12 February 2015,9,when i first watched this movie i didnt have very high hopes for it but i was surprisingly shocked on how well the story was written even though its your standard revenge movie and yes it was a little slow in the beginning but it all pays off after about minutes into it and boy it does not let off on the action and suspense i highly recommend this movie has great characters awesome action scenes and a pretty good sound track only problem like i said is it is slow on some parts but overall this is a good movie to just sit and relax while munching on popcorn i was not disappointed at all with denzels performance stars,0.9901,1
"simple story , happy ending , action packed",inanisumeet,22 March 2015,8,the production values are high literally lot of money has been put in the movie sony gadgets on display as mobile laptop etc denzels clever remarks and binding with chloe is touching why does he clock the fights he enters into vigilante by night and retail store worker by day never shows off in public neither revengeful nor expecting appreciation after helping warns before handing retribution helps the weak secretly tells girl very nicely without offending psychoanalyses the villain sharply asks probing questions from thugs disguised as police anticipated reaction sets trap accordingly blows up buildings steps out in fiery background we love him for his good nature swift justice,0.9124,1
