Title,Author,Date,Stars(out_of_10),Review,Sentiment_Score,Polarity
May the Blood Flow,Tweetienator,6 June 2019,8,denzel washington is just great and the equalizer belongs like the john wick keanu reeves and taken liam neeson movies to the new masterclass of revengevigilante movies the equalizer is a true to the heart successor of our former or still heroes of long gone times like mr eastwood and mr bronson the king is dead long live the king so to say the equalizer is great stuff if you like your action spiced up with a good shot of violence,0.9451,1
Denzel Washington made this film better than it was,Top_Dawg_Critic,27 July 2018,8,so i just finished watching equalizer again so i can watch equalizer for the comparison its too bad both films had the same director and writers as they have a bad habit of dragging out the writing and the scenes both films at just over hours is just way too long especially in the simplistic singular plot or however that plot still worked and mainly because of the entire casts especially denzel washingtons performances certainly had better pacing and a more suspenseful plot albeit predictable however it had many plot issues and holes as well as some scenes that needed to be edited down the new supporting cast was not as strong either which did i enjoy better probably by a small margin but they both got an from me as they each had their merits and issues nevertheless still enjoyable i hope if they come out with a they speed up the pacing within the writing and directing,0.9337,1
Denzel nails it,Leofwine_draca,8 September 2015,8,an intense and towering performance from denzel washington as one of cinemas bestacted action heroes is what makes the equalizer stand out from the crowd although as a film its also a very decent thriller its supposedly a big screen version of the tv series with edward woodward although think of it as your usual vigilante movie and youll be closer lets be honest here the plotting in the equalizer is nothing special and the russian mob make for clichéd villains its the execution where this film excels its not an action filled movie but when the action hits its hard and heavy not shying away from crowdpleasing violence meted out to the villains the extended setpiece ending might be described as die hard in bq and loses the realism a little but but until that point this is tough and gritty filmmaking aside from the excellent washington we get a fine bad guy performance from martin csokas equally intense and the finest ive seen from him and chloe grace moretz is wisely kept offscreen for most of the running time which i was fine with the final shoutout goes to director antoine fuqua whose effortless style makes this a graceful and thoroughly entertaining viewing experience,0.0769,1
A Stylish And Daring Action Thriller,CalRhys,3 October 2014,None,antoine fuquas and denzel washingtons paths collide once more as they come together to create a stylish and daring action thriller about a man with a mysterious past whose quiet life suddenly turns into a rip roaring adventure of guns and thrills both denzel washington and chloe grace moretz give stellar performances and display perfect chemistry as two friends stuck in a world of crime and violence arguably fuquas best film since training day the equalizer is a brutal and merciless tale that explores the russian underworld on the east coast and the corruption ties within the law enforcement of bostons police department,0.765,1
"Gruesome at times, The Equalizer is a rewarding action film for every single Denzel Washington fan out there.",LloydBayer,24 September 2014,7,rooting for a badass hero with a kickass attitude has never been as satisfying as watching denzel washington dish out some brutal punishment this is exactly what you get in the equalizer an action thriller based on the late s tv series of the same name but amped up with ultraviolent realism reunited after their collaboration in training day washington received his first academy award in a leading role and director antoine fuqua are back in this simple yet deadly effective action film using a mark twain quote about people who find their true purpose late in life washington plays robert mccall a loner and tragic widower with a mysterious past on the surface he is an amiable home depot worker who keeps to himself indulging in conversations only when spoken too and slave to some sort of ocd while remaining invisible to people around him after befriending a russian teen escort called alina chloe grace moretz all grownup and discovering she is the victim of sexual abuse mccalls niceguy demeanor melts away to expose an aura reverberating layers of darkening complexity theres a tightly restrained compassion in mccalls eyes fighting a fatherfigure compulsion to do what he must while alinas is a muted plea for deliverance this scene takes place in a diner they frequent in boston and its the first of two powerful moments in the film what follows is the films first action sequence in a tarantinostyled dialogue first and blood splatter later mccall dispatches alinas russian pimp and his goons when news reaches moscow mob kingpin pushkin sends teddy marton csokas to clean up the mess covered with satanic tattoos teddy is anything but the moniker he goes by and with half the boston pd on his payroll its just a matter of when and where mccall is eliminated or so they think having previously scripted the expendables richard wenks story here is nothing new when considering mccalls proverbial set of skills a comparison if you must to certain characters liam neeson has played on the other hand there is a mechanism in place partly due to the aforementioned ocd allowing mccall a brief study of the situation before striking with lethal accuracy while that sounds like a knockoff version of combat tactics employed by guy ritchies titular hero in sherlock homes the payoff is watching mccall take out bad guys with improvised weaponry it gets a bit hokey towards the end with mccall using all manner of booby traps to slice dice and blow up teddys dumberbytheminute henchmen having said that it is still rewarding to watch washington demolish enemy after enemy and this is largely due to csokas terrific portrayal of teddys loathsome nature to that effect the best scenes in the film are when teddy and mccall are facetoface and denting each others armour with nothing but well written dialogues one such scene is a powerful dinner table batteringofwits a taut reimagining of that iconic scene in heat while humour and drama throw some light on bostons mob controlled dirty cops mccalls relationships with his colleagues and even a short segment that suggests his origins as a trained killer the equalizer really shines with fuquas deft handling of action scenes but topping it off is washington in a vigilante role that is the best weve seen in years fans of man on fire washington opposite dakota fanning and léon the professional jean reno opposite natalie portman both films about male heroism influenced by female protégés are in for a visual treat heck who needs improbable superheroes when you have an average joe with extraordinary capabilities and all without hiding behind a mask or costume although compelled to use the nword ill just say ma man denzel doesnt disappoint and neither does the equalizer,0.9829,1
Home Depot EQUALS a bad place to be while on Robert McCall's bad side,mjacksongta,4 November 2015,8,in terms of an action movie i gave the equalizer a but soon after felt the need to watch it again and then upped it to an why well its an action movie but yet theres no crazy car chases theres no bombs or heavy big explosions every where really the only action scenes are the fight scenes and even they dont come that often but when they do come they deliver denzel is as awesome as ever in these scenes and the creativity in these scenes are what sets it apart from every other action movie the main character robert mccall in an ex specialist of some sort you dont know what at first but know that hes highly trained in something and is now working as an ordinary man working at home depot or home mart as it is in the movie he looks like just your every day man but can kill you with just about any everyday weapon and he does this so calmly that big crazy car scenes and explosions would rake away from his character a man that takes the bus to come kill a whole gang is pretty bad ass by any standard as always i dont want to give spoilers but i do recommend this as a good wholesome action movie,0.6602,1
"Mostly atmosphere, zero story",ToddWebb,5 October 2014,6,at the end of it all i found this movie very boring the story is old as dirt the plot is so obvious that as soon as characters appear on screen one can identify hell be killed shell be kidnapped and used as bait something bads gonna happen to him and my alltime favorite hes the innocent likable guy introduced early then ignored for minutes so well forget about him only to have him turn up as a hostage in the big showdown and every prediction is spoton example of bad writing two thugs walking up to a door the last thing thug says to thug as they approach the door whatever you do dont call him little john very next shot inside the door thug starts talking smack and guess what he does when the setup is literally seconds earlier we all see it coming give us the setup in a different location maybe or at least disguise the setup amidst a longer funnyentertaining conversation nope just lay out that one line setup then walk on in we the viewers will just deal with it denzels character is likable i mean insanely likable beyond the depth of my willful suspension of disbelief likable hes always friendly always in a good mood always smiling hes ecstatic just to be alive everyone loves being near him hes never just a guy hes more helpful than a college professor more inspirational than a priest more motivational that a fitness instructor every scene in his workplace which is visited repeatedly throughout the movie includes no less than background guys smiling giddily when denzel arrives to work and laughing loud at every word denzel speaks going to work at home depot sorry home mart surely isnt like that in real life but theres more to denzel isnt there who is this guy whered he come from who knows well never know but clearly hes badass more moves than shakira and deadlier than seal team six he seems to know how to handle any situation and any number of attackers just because no reason hes just awesome if you ever saw the classic comedy planet terror just think of the scene give him the gun give him all the guns because ya know hes just so badass for no logical reason the bad guy was awesome while denzels fight scenes were a lot of superclose blurry shots the few scenes where the bad guy establishes his badness were rather good very tense very violent and cringeworthy the equalizer has all latest bells and whistles with music atmosphere and buildup the one female lead is developed nicely especially compared to every other innocent victim who may as well have stepped out of little house on the prairie much of the movie is very tense and keeps you hanging on to each scene waiting to see what happens next but ultimately we all know denzel will kick ass so its all just a waiting game it felt very long the wait is made so much worse when the viewer knows exactly whats coming theres just no surprises here youve seen this movie times im sure oh yeah and denzel knows everything he appears magically inside buildings and rooms where one shouldnt be able to sneak in he has cell phone numbers one shouldnt have access to the characters even comment on it how the hell did you get that number no answer doesnt matter its a movie just turn off your brain and enjoy the tension building how does denzel know when the bad guys will appear at a time and place so he can intercept them in the night dont know doesnt matter i guess how does denzel sneak into a closetsized room without the occupant noticing how does denzel have time to set up his trap rig wires etc without anyone seeing this work being done who cares the resulting deaths are cool go to sleep tune out enjoy but dont expect to take this movie with you youll have forgotten it by the time you leave the parking lot,-0.9782,0
"If you love Denzel, and you loved Training Day, and your only wish was that that bad-ass could have been a good guy, then this is the movie for you!!!!!",missgriffin,10 September 2014,10,the equalizer is not man on fire the equalizer is not your typical action flick washingtons robert mccall is not selfdestructive or addicted though there are great choreographed fights special effects and fantastic explosions the equalizer is more bourne than bond denzel washington portrays this excia operative who is content to live a meticulously simple life quietly contained but with everbuilding intensity washington turns in another stellar performance chloe grace moretz as the teenage prostitute is a force antoine fuqua the directer who brought us training day which earned denzel his best actor oscar helms this movie with a steady hand his direction of the drama and the action blend seamlessly drawing us into the complexity of this characterdriven piece robert mccall keeps to himself content to live his ordinary life he is every mans man but his steady moral compass and strong sense of justice lead him back into the fray this character is not infallible and he is not looking for trouble he just wants whats right this film is a superbly acted exciting and violent ride in the pursuit of justice there will be blood but this time youll be rooting for the good guy and i a fifty years young woman loved every minute of it,0.9931,1
Cliched but a fun ride yet!,yogiv,23 July 2019,7,cliched and done to death formula but still fun to watch on a night when you dont want to be bothered with something cerebral denzel washington is good as ever the russian mafia doesnt stand a chance in hell anyway am gonna hit the sequel next folks,-0.7134,0
Really enjoyable movie,danielmanson,18 June 2022,8,for years now ive had people tell me i have to watch this and for whatever reason ive kept putting it off today i apologise because this is a fantastic film and i really enjoyed it what struck me straight away was that first mins or so im sold it tells us the characters you can see where its heading and it fished me in quickly from then on it was just an insane and tense ride what was great was that every scene had a purpose there was no messing about no filler scenes with no point everything meant something and thats a rarity in this day and age the suspense by the way wow had me on strings the entire time never knew which was it was heading i really enjoyed the characters as well denzel wasnt just this stereotypical action guy that went round shooting people there was so more more to him more complexity if you will and with that there was more to delve into you definitely get a john wick vibe to this movie and with the main character so if you like that youll like this just a quick mention i would have liked to have seen elenateri more i felt she had a lot of depth that could have been explored i think my only i guess negative was that the villains evilness wasnt explained or explained well not sure if i missed it but i didnt truly get why he was so evil but yeah overall i really enjoyed my time watching this and ill be jumping on the equaliser asap definitely recommend if you like an action a very strong from me today,0.9314,1
Colder Opportunities,billygoat1071,1 October 2014,6,the equalizer is loosely based on an television series with the same name this reinvention in comparison aims to be darker and much violent but the films ambition is basically turning its star denzel washington into a grittier action hero it somehow pays off when he starts killing bad guys in cold blood and its amazing how he could still carry the characters humanity along the way the film troubles when it gets out of hand to its glorious vigilantism despite it takes place in a world seems apart from that context if you tend to ignore the sentiments and shade of reality you can still tell that its a pretty entertaining piece of action but in general its just difficult to not notice its mess of tones even with that amount of fun there is one side in the film when its totally gripping that is when we just see the protagonist as a person living in an ordinary life often being with people and often encountering them getting in trouble by crime this grounded world just keeps most of its darkness in their presence sometimes feeling like a doomed helpless world but once the hero reveals what he truly is capable of it doesnt actually sucks out its entertainment quality but it does betrays that intriguing context nearly turning itself into a superhero movie except of course its less silly and much violent mccall in shorthand is too competent for any criminal he fights and often leaves with a perfect swagger it may not be big deal to many viewers especially the action fans who are already enjoying the blood but the film sets up an existing theme that seems to be a lot interesting to consider instead of indulging itself with its own way of justice the cool slowmos and stylish special effects might have also rob the sense of realistic tension but put that aside each action scene is watchable enough we dont usually see a wider blockbuster today that has the guts to fearlessly show brutal movie violence like this this is probably the only mundane element existing in those set pieces denzel washington shifts his character to two personalities one is the likable ordinary man himself and the antihero with a hidden cosmic hate through its world the performance does sum up the overall movie from gravitas to smugness and whats great is theyre both effective anyway however the villains and their tattoos have blatantly shown that theyre evil the main antagonist seems like hes written to be overthetop almost like a cartoon villain than a believable human mafioso but marton csokas gives a little grimness as he have fun with it the equalizer would have been nicer if it was a little shorter and much consistent but i could guarantee that it still entertains it does have the appeal through its action and acting though there are more serious things that could have made it a lot compelling thriller the film does have the knack of embracing either of its elements but it just keeps shifting back and forth like were not getting to the actual big picture well if you can accept that the hero is this superior then it might work better for the experience for now it can be endlessly watchable but you will only find few things that are remarkable about it,0.9923,1
"McCall...NOT McClane!! Dark, edgy violence, as well as fantastic performances separate this action movie from the pack!!",cap96,17 September 2014,10,some reviews have characterized this movie as your typical runofthemill action movie nothing you havent seen beforenothing could be farther from the truth this movie is based off the television series called the equalizer it is about an excia operative who uses his special skills to help ordinary people who have no other recourse this movie version of the equalizer is more reminiscent of matt damons jason bourne and it is this that sets this movie above your typical action flick in fact in mr damons own words the equalizer reminded me of the bourne identity in that both are sophisticated adult thriller franchises where the protagonists are capable of highaction exploits but arent running around in spandex directed by the great antoine fuqua the man who brought us training day the equalizer is a gritty and violent suspenseful and superb action film this movie is very characterdriven and denzel washington who plays protagonist robert mccall gives another stellar performance his character lives alone keeps to himself and seems to suffer from some form of ocd most importantly mccall is not mcclane he is not a wisecracking cop in the wrong place at the wrong time but rather a quiet and complex character whose sense of justice is awakened when a young girl is brutally beaten this movie gives you everything you would want from an action film guns explosions and great effects however the violence and bloodshed in this movie are deserving of its r rating and create this films authentic feel the excellent performances by the cast are also what raise this movie well above your ordinary action movie team washingtonfuqua gives us a darker hero for darker times and one you will cheer on every step of the way,0.9575,1
Welcome To The Black Rambo,TheAnimalMother,10 October 2014,6,fairly solid action scenes characters and overall execution somehow the filmmakers and actors make this very hard to believe film enjoyable this is definitely a sensationalistic filmthe most sensationalistic of washingtons career without a doubt and its mostly a regurgitated cookie cutter crowd pleaser of violent vengeance as well but it does manage to remain quite an entertaining action film at the same time even though it has a running time of over two hours the film does feel overall as though it is missing a few key scenes but nonetheless its still worth a look if youre into these kinds of films the movie didnt remind me much at all of the old tv series of the same name the film is much more reminiscent of some of the old brutally violent morality tales that charles broson use to do all that said this basically chalks up as a good film to watch when you dont want to think much and you just want to watch a lot of kick ass entertaining violence its that kind of guilty pleasure,-0.8322,0
Could have been great if it hadn't turned silly,mikegibb-60418,26 May 2020,5,the film starts so well interesting character played by washington a quiet man who goes to a coffee shop at am every night to read one of hundred books recommended by his wife before she died and there he meets a young prostitute who he tries to help when she gets beaten up then suddenly he turns into rambo and starts slaughtering all the bad guys in greater boston the last twenty minutes are just ridiculous he tackles and destroys a small army of baddies armed with sub machine guns using the contents of the diy superstore where he works he could picked up half a dozen of their weapons but no he tackles the ruthless leaders armed to the teeth with a nail gun and of course wins it was like watching an adult version of home alone and then obviously getting leave of absence from the home works depot he travels to moscow and kills a mass of russians what a waste of a good actor and an initially good plot idea,-0.4661,0
Effective and dynamic,FrenchEddieFelson,16 March 2019,None,in the inventory of almost normal heroes like jason bourne jack reacher frank castle bryan mills john wick here is a brand new one robert mccall aka the equalizer he gives a chance to the unlucky ones against the villains by equalizing the forces in this first opus he meets by chance a prostitute as young as lost and hop hop hop he annihilates the russian underworld of boston wooooow sounds easy the result is rather successful i loved it,0.9034,1
good start but fight in Home Depot disappoints,SnoopyStyle,6 March 2015,6,robert mccall denzel washington has a mysterious past and is trying to live the quiet life working at a boston home improvement box store he helps his coworker ralphie lose weight to get the security guard job hes friendly with street walker terialina chloë grace moretz whom he often meets as he reads at a local diner she ends up in the hospital after getting severely beaten up by her pimp slavi he tries to buy her freedom but ends up killing everybody violent russian gangsters come looking for payback this starts well even with the clichéfilled script denzel can pull it off chloe is the innocent and hes the knight in shining armor the problem starts when chloe disappears after the first act i expected her to be the second star and she deserves to be shes good in this movie but it is strictly a solo act the great brutal violence in slavis office is the highlight the action slowly turns more and more cartoonish director antoine fuqua has made some great gritty action i wish he brought a bit more training day unfortunately the last battle in the home mart reminds me too much of home alone there is something compelling about not showing what happened with the hammer thats a great scene its a little more silly to see all the improvised traps in the store,0.0712,1
