Title,Author,Date,Stars(out_of_10),Review,Sentiment_Score,Polarity
It will be an unforgettable experience for fans of Denzel Washington's genius.,sudheeshthulaseedharan,11 November 2020,8,the action thriller directed by antoine fuqua and was released on starring denzel washington marton sokas klose grace morets david harbor bill pullman and melissa leo the film begins in a low rhythm and quickly reaches an explosive state shines brightly robert mccall is a man with a mysterious past now he is a gentle and ordinary man who goes to work hard and leads a solitary life as an employee of a hypermarket in the city meanwhile he meets and befriends a young woman named terry at a restaurant he regularly visits at night one day in front of robert she is abducted by russian mafia men he later found her in a hospital with injuries sustained as a result of the brutal torturing he realizes that she has to escape the clutches of the russian mafia in order to have a good life with this there is no doubt that the revenge against the terrible russian mafia for the calm natural robert will thrill the audience along with the theme and the excellent performance of actor denzel washington he fought against the injustices before him and came to the aid and shade of the helpless common people the different presentation excellent cinematography and heavy bgm bring the film to a high standard i am sure the equalizer will be an unforgettable experience for fans of denzel washingtons genius,-0.25,0
Justice is Equal,aakudev,15 January 2015,6,a good better than average movie it was all about action and good old fashioned revenge for the dear one if you go with a lot of brains in the movie then you will be disappointed for sure the movie has a simple story but many things about the lead were unclear and well you can say a hero is a hero and luck and script is always with him hehe direction was good denzel was good the mafia people were also ok overall it was entertaining but as i said if you try to be logical here then you will miss the action so just go ahead enjoy the action and have a good time,0.991,1
Superb,jontait2002,13 September 2020,10,superb film denzel carries the character perfectly if it wasnt for the drawn out final showdown which felt a little too much like a die hard movie to fit in with the rest of fhe movie it would be one of my all time favourites,0.8288,1
The Equalizer: a good 'God of Vengeance' type of film.,niutta-enrico,13 December 2014,7,when as a kid i was asked what the searchers was about i told that a comanche tribe had the stupidest idea you could have in far west killing john waynes family and that the rest of the movie was the inevitable consequence of it this was my first encounter with god of vengeance kind of film and i liked it just as i liked the present one there great sceneries filled the screen here very good action fantastic lighting and the astounding performance of denzel washington nail you to the seat i dont think this kind of films has a good influence on kids to me it seemed that john wayne was right the revenge he pursued was noble and killing those indians made him a better man if a comanche tribe ever were to show up in rome and kill my family well i dont how it would have ended but you know probably i just was the only stupid kid on earth,-0.0837,0
Great,richards-20455,13 November 2020,9,full action and funny moments great movie to watch,0.7906,1
Crescendo,mgd_m,14 April 2019,6,first act the plot has potential its a bit slow but lets see how it develops second act the villain is interesting but denzel is some kind of supernatural force i dont buy that i think this is the umpteenth silly action movie third act ok i get your point the hyperbole is so clear and so fun now that i like it i like the character who fully shows himself for what he is i like the funny killings and the bold lines this movie is a linear crescendo and i think youll get rewarded if you have patience my rating is some kind of average between the three acts,0.9778,1
Denzel y u do this?,arsasuperman,15 December 2014,4,the summary says it all he killed more people than rambo with more gadgets than macgruber this is the kind of a bad move i wish he got a lot of money for because it is not very good and is one of those what did i waste my time on plot retired mystery man with great skills who stooped doing dirty stuff because a promise to his dead wife goes against the whole russian mafia for a prostitute with a good voice witch we never hear he hangs around with when she gets beaten by her pimp to sum it up do people really think one man can kill the entire russian mafia and a few petty criminals along the way with house whole applianceschemicals the only reason i gave it stars and why this movie is different than low budget tv movies is because of the actors and their performances,-0.9849,0
Rescued by Denzel,sniffynixon-33443,10 December 2019,7,this is a pretty standard by the numbers action movie which is saved from total mediocrity by the usual brilliant performance denzel washington a film that would otherwise quickly fade from the memory if it wasnt for the stylishly filmed moments of morally questionable ultra violence punctuated throughout its length the final showdown is certainly one of the more gruesome and imaginative endings i have see in a while,0.6808,1
without knowing that the help comes from him,kurdojelal,17 July 2019,10,an incredible story where a man who looks ordinary but actually has a very powerful killing ability and is very concerned that he is willing to put his life in danger to help the needy without knowing that the help comes from him very recommended for those who likes action,0.6915,1
Denzel kicks Ass,BecauseIAmBATMAN,13 December 2014,7,the story isnt anything new or unique the plot is fairly predictable denzel plays an unstoppable badass antihero who kicks ass this pretty much sums up the film but its solid entertainment the action sequences are wonderfully executed some very interesting kills in the film without the use of many guns the atmosphere set is wonderful the film feels a bit long at minutes and certainly could have been a bit shorter but its still entertaining throughout its runtime you will certainly enjoy some great rrated violence if you are a fan of it denzel acts very well and is a badass you will root for a solid,0.9883,1
"Ok action movie, but has nothing to do with the TV series",Gray62,1 November 2018,7,as an action movie this would have rewarded points despite logical flaws like wtf leaving fingerprints everywhere however its been styled as being about robert mccall the star of the tv series but its got nothing to do with that character and that aint denzel washingtons fault who did a stellar job but that of the screenwriters and producers the movies mccaul is simply a totally different character from the tv guy so to advertise this movie as the equalizer is fraud theres no way to excuse it younger folks who dont know the series may not care about this but if you had been a fan you will be disappointed,-0.9034,0
One Of Denzel's Finest.,john_carlin,1 May 2023,8,denzel washington is one of the greatest living actors of this generation and the equaliser is a very well made film that allows him to showcase his outstanding acting abilities the equalizer is a thoroughly enjoyable actionthriller that has superb performances from both denzel and martin csokas the latter portraying the main antagonist of the movie with their sit down dialogue scene in the restaurant across the table from each other being one of the coolest and most memorable scenes in the whole movie i recently went back and revisited this movie in anticipation of the movie in the trilogy being announced and had a very good time with it if you enjoy action violence and superb acting then i highly recommend giving this movie a watch for me,0.9822,1
When Pushkin Turns To Shove...,Lejink,3 May 2021,6,i can vaguely remember watching at least a few episodes of the original tv series of the equaliser which starred edward woodward and boasted a quirky theme tune by the police drummer stewart copeland woodward in his day was a serious wellregarded if very actorish performer whose very appearance in such an action antihero role as the avenging angel of boston raised eyebrows about him slumming it at the time but as i recall the show was very successful especially stateside and certainly ran for a few series i say this because for me the idea of washington who id probably say is one of todays more serious wellregarded if a bit actorish performers taking on such a part in this glossy hightech adaptation is one i found similarly surprising its almost a black superman role as he plays by day a mildmannered heartofgold gardenretail store employee supportive of his coworkers checkedout by the discerning older lady amongst them but who keeps himself very much to himself when he clocks out he lives quietly and anonymously in a small apartment and plays the nighthawk in the evening by haunting his local diner where he eats his meals quietly reading a classic book to pass the time hes acquainted with a fellowcustomer a pretty young russian girlprostitute and its through her mistreatment by her vicious pimp that we discover mccalls secret as he turns into a veritable onemanarmy to take on the powerful russian mafia operation of which prostitution is only one strand headed by the mysterious oligarch mr pushkin mr p then sends over his top terminator teddy rensen marton csokas a mean mistreater if ever there was one as you can tell by the tattoo count on his musclehoned body as the film builds towards its inevitable faceoff between the two which unusually takes place back in the very store mccall works by day by this time weve learned that our man is a retired special operations operative who walked away from the job when his wife died and really isnt to be messed with but those pesky russians just dont see this and keep coming after him allowing mccall to devise ever more gruesome means to despatch them onebyone and of course being the kind of guy who doesnt leave a job halfdone theres a final reckoning with the big boss man in his own lair which serves as a kind of epilogue im not averse to this kind of very stylised if very violent action thriller i know my bond from my bourne although the levels of excess employed here make old jimmy and jase seem like amateurs compared to what old bob gets up to the action sequences are ruthlessly choreographed and extravagantly set up using the by now familiar devices we associate with this type of designer violence with its mix of pinpoint jumpcuts pyrotechnics super slomo and rigorous fight sequences denzel probably gets as little dialogue as hes ever had to speak in a movie as the strongsilent mccall while csokas makes for a suitable if ultimately doomed protagonist its all served up with a pounding industrialtype soundtrack just as youd expect i wont deny that i enjoyed this clichéd mindless maelstrom of a movie held together by dens eyeofthestorm lead role and as for denzel as an allaction killingmachine well if edward woodward would why wouldnt washington unsurprisingly i see the film was successful enough to spin off a sequel and you know one of these crazy old nights in the not too distant future ill probably disengage my mind again and check in on what mr mccall did next,0.5435,1
Awesome revenge movie,Valkonian,23 June 2021,8,i love this movie denzel is so good in this role like liam is in taken the movie actually pumps out some good messages the bad guys are really nasty so when denzel gets nasty on them you cant help but root for him,0.0822,1
"""Sometimes we make the wrong choices to get to the right place.""",Bored_Dragon,9 March 2020,7,i have not watched the series of the same name on which it is based so i have nothing to compare it with but it did not leave a special impression decent action movie for one watching a little stronger rating because of chloë grace moretz who was the reason i saw it in the first place,0.4582,1
A bottom-shelf action thriller barely salvaged by its top-drawer leading man.,shawneofthedead,24 September 2014,4,its a tantalising thought denzel washington reunites with director antoine fuqua for a pulseracing thriller about a man who seeks to right equalise wrongs done to innocent people perhaps they can once again hit upon that thrilling blend of action and drama they cooked up in training day which won washington his second oscar unfortunately washington is pretty much the only good thing about the equalizer which is really little more than a pulpy straighttodvd film rescued by the efforts and charisma of its leading man robert mccall washington keeps his head down and his profile low at his new job in a hardware store clearly hoping that the ghosts of his past will eventually disappear when he befriends teri chloe moretz a desperate waif forced by the russian mafia into prostitution he finally decides to help people with the deathdealing skills hes been trying to keep hidden after roberts bruisingly bloody confrontation with teris pimp the terrifyingly efficient terry marton csokas is dispatched by his russian ganglord to get to the bottom of things this is the kind of thriller in which the bad guy portrayed as enormously smart and powerful lets the good guy slip out of his grasp for reasons of prolonging the films running time theres even an extended sequence at the end of the film in which terry just stalks through a gigantic warehouse for something like twenty whole minutes never finding robert until their climactic showoff fuquas film is almost unapologetically pulpy too setting robert up as an ultraviolent vigilante who gives his antagonists the choice to clean up their acts before he does it for them itd have been great if the equalizer had dared to be a little more introspective delving into the moral greys and difficulties robert encounters in hunting down terry and his gang but in the bloodshed that explodes all around robert most of it caused by him in almost chillingly cold blood it actually becomes harder and harder to tell whether were supposed to be rooting for robert in the first place even as the film practically yells at us that hes the most heroic person in this entire godforsaken mess truthfully the equalizer is the kind of film youd imagine with jason statham in the lead a disposable actionthriller with murky morals that exists solely for carchase sequences and bulletplay the fact that it stars washington is both to its credit and its disgrace he makes the film worth a watch actually finding something a little human within a character who wasnt really all that wellrounded on the page but fuqua also wastes him failing to find and colour in the layers and depth washington could so easily have given robert for what its worth csokas is a worthy adversary stonecold and utterly brutal who stands up quite well against washington to be fair fuqua directs the film with his trademark ferocity and many scenes drip gore menace and tension in equal measure theres even a little welcome comedy courtesy of ralphie johnny skourtis the wannabe security guard who becomes the films accidental hero but its not really enough to save the equalizer from itself the film practically begs to be allowed to build a new franchise around its buttkicking protagonist but fails to prove why anyone but the most diehard of action aficionados would really want to see much more of mr mccall,0.986,1
Enjoyable modern day superhero type action,sickofenjoyingmyself,14 July 2015,7,this movie was actually better than i expected it was kind of a mix of bondbourne type ingenuity action with an added modern day superhero quality the type that allows the viewer to get a bit carried away with all the action without questioning how believable the story line is for me it has some great high adrenaline action and at the centre of it all is the ever cool denzel washington the story line tends to delve further into the unbelievable the further it goes on eventually to the point where you wonder how mr mccall could so easily seemingly return to his normal everyday life after such outrageous public exposure but then you remember that its all about unapologetic action and doesnt try to be particularly believable or convey any deep and meaningful message it sets out to entertain and that it certainly does,0.9294,1
Comic book stuff but entertaining,miked-26800,2 July 2021,8,denzel washington is excellent as the invincible hero taking on the russian mafia his character is a combination of steven seagal and james bond he easily takes on five at a time and finishes them off in various gruesome ways his super baddy opponent is played in very over the top style by marton csokas the fate of csokas is never really in doubt and is of course saved for the final extravaganza of violence simplistic stuff but entertaining and well directed,0.9489,1
"""Sometimes we make wrong choices to get to the right place.""",yasinhussain-14721,29 August 2023,7,a good few years ago i tried giving this picture a go i got minutes in before realising yeah im not really enjoying this i gave it another shot though some time later literally exactly the same thing occurred but with the equalizer just around the corner i thought i should watch this properly from start to finish to get an idea of whether or not the third installation will be worth my money and based on the equalizer even though i dont think a installment is justified let alone a im happy to head to the theaters to simply sit back and enjoy the action that this has to offer what elevates the first movie compared to any other ordinary action film is primarily the awesome sawlike kills that we get to see the gore in this is more extreme than your standard action flick but at the same time it isnt too intense for it to be a turnoff in the slightest it actually makes this rather exciting in addition i imagine it comes as no surprise when i say that denzel washington was superb as the silent stonefaced avenger robert mccall but the person who surprised me was chloë grace moretz who with the little screen time she had shocked me with her almost authentic depiction of the vulnerable fearful sex worker teri especially in the first act and i loved the scenes with robert and teri together we got to see their friendly bond with each other and that was delightful to witness even if those moments were only few and far between but yeah im going to have to leave it there since im really trying to cut down how much i write nowadays all in all though if youre an action fanatic and you havent checked this out already its definitely worth the watch,0.9928,1
All things are not equal,malcolmlusby-146-613669,22 October 2015,9,one of the most exceptional movies in the last few years denzel washington provides a compelling if not totally believable character working off of the television show with edward woodward the story cuts a remarkably good plot but do not expect too much from it or you will be disappointed the biggest critiques i have heard from people are that there are elements of the movie that make no sense and this is primarily because the scriptwriter has seen the original series and assumed a lot of the character into evidence but there are notable points in the movie that occur once never to be seen again that make you wonder exactly why the heck they left it in my biggest complaints are that there precious too few action scenes martin csokas owns the bad guy role to the nth degree but with a sinister malevolence rather than a kick your ass approach washington is pretty damn hardcore in this but his kickassomoter barely reaches a three on the frequency of scenes scale chloe grace moritz plays an outstanding supporting role but again there is not enough of a back story to merit the movie i would have liked them to have drawn out her situation in significantly more detail testosterone moment came from scene stealer haley bennett and her apparently endless legs certain elements of the film are just entirely too stupid to handle with one particular interrogation scene that will have you screaming at the screen why doesnt he just press the damn button other than those complaints the acting with what is a great plot but a relatively poor quantity of action is utterly superb and it gives a fine start to what could be a fantastic series of movies,0.7528,1
Denzel is Denzel.,wolcottalexander,8 April 2023,6,action is action not much more to say i thought it might be a slow burn with a violent burst at the end but the action starts early and is consistent throughout without a star actor in the lead role this movie is probably a but denzel is denzel and carries the day very violent movie some good performances from the supporting actors overall a solid entry in the action genre but nothing special i give it a rounding down to if you like action movies and you like denzel washington then sit back and enjoy i wish my local lowe depot was as clean and well staffed and well organized as the fictional big box home center shown in the movie and i wish denzel washington worked there,0.9786,1
Possibly the best action film ever made,somekindofdubway,22 May 2018,10,if you re a fan of movies with every day bad a heroes then this one is for you basically denzel plays a retired government agentassassin but he is now working at a diy storestore he meets a woman who wants to be a singer but is being exploited by russian gangsters denzel is a firm believer in helping his friends achieve their goals and does not like to see injustice so anyway he helps the lady he met out of her situation but in doing so opens up a whole can of worms if you like movies like die hard john wick but dont like this movie then you may have to ask yourself a question am i a racist only joking sort of,-0.9585,0
"Morose and feisty, decent enough to catch action movie buffs' eye",Junreviews,6 December 2014,7,what makes a great action film showcasing a charismatic protagonist that bustles all sorts of powerful moves or would it be the thrilling plot that revolves around intriguing motives and cynical enemies the equalizer possesses both elements while featuring a veteran denzel washington who plays robert mccall still has what it takes to waltz through a plethora of wrongdoing by helping others and equalizing the corrupted society the movie gets intense as the days of mccall ensue it begins with an ordinary routine by showing mccall commuting via public transit and gradually foreshadows unique aura that differentiate him from his coworkers in the warehouse center then he spends his night reading in the café where he often chats with an indecent and polite girl teri played by chole grace moretz she manages to handle such a promiscuous role pretty well it will take anyone by surprise when you find out her age the prowess of washington really makes this movie worth watching as his indomitable strength nonchalantly gets unleashed in order to take out the mafia nifty swift and impeccable every movement he makes is a sight for sore eyes thus the editing seems welldone in terms of cutting and panning the scenes the russian mob and their dastardly stooges fit in well as they go head to head with washington verbally and physically however there is a number of improbable moments that put you into thinking that perhaps mccall is invincible despite his strength of being such a skilled combatant it is unrealistic for one guy to catch his counterparts redhanded in a jiffy as well as thwarting the armed group of mob although that might get resolved by the scene where he heads to the majestic dwelling to debrief his enemies from a lofty couple who seem to be related to the president it is safe to posit that mccall used to work for the united states secret service which explains why he is so formidable in a nutshell the equalizer is packed with breathtaking fights in which washington acts like the present version of cavalier it is also a nobrainer because there is neither conundrum nor mystery thus you dont need to heed the plot but let your emotion and time to be enraptured by a series of exciting and stimulating scenes that do not feel redundant,0.9824,1
